{
  "project": "bm",
  "profile": "S",
  "base_branch": "main",
  "generator_version": "0.9.0",
  "stage": 1,
  "tasks": [
    {
      "id": "M01",
      "title": "Project scaffold and CLI",
      "goal": "A uv project with bm --help, ruff, mypy and pytest runs.",
      "why": "All further modules build on the scaffold and its commands.",
      "satisfies": [
        "D4"
      ],
      "status": "done",
      "depends_on": [],
      "complexity": 3,
      "stage": 1,
      "parallel_group": null,
      "scope_write": [
        "pyproject.toml",
        "uv.lock",
        ".python-version",
        "bm/__init__.py",
        "bm/cli.py",
        "bm/config.py",
        "tests/test_cli.py"
      ],
      "scope_read": [
        "ARCHITECTURE.md",
        "AGENTS.md"
      ],
      "acceptance": [
        "A1",
        "A2",
        "A3"
      ],
      "gates": [
        "lint",
        "types",
        "tests"
      ],
      "owner": "worker-1",
      "branch": "task/M01",
      "worktree": null,
      "round": 0,
      "evidence": [
        "ruff: 0",
        "mypy: 0",
        "pytest: 6 passed"
      ],
      "scope_write_forbidden": [],
      "handoff": [
        "Run everything through uv: uv sync, uv run pytest, uv run ruff check ., uv run mypy bm."
      ]
    },
    {
      "id": "M02",
      "title": "Store and schema",
      "goal": "SQLite database, schema and repository for bookmarks work.",
      "why": "M03 needs saving, listing and searching; M05 needs export/import.",
      "satisfies": [
        "D1"
      ],
      "status": "done",
      "depends_on": [
        "M01"
      ],
      "complexity": 4,
      "stage": 1,
      "parallel_group": null,
      "scope_write": [
        "bm/store/__init__.py",
        "bm/store/db.py",
        "bm/store/repository.py",
        "tests/test_store.py"
      ],
      "scope_read": [
        "ARCHITECTURE.md",
        "docs/data-model.md"
      ],
      "acceptance": [
        "A1",
        "A2",
        "A3"
      ],
      "gates": [
        "lint",
        "types",
        "tests"
      ],
      "owner": "worker-1",
      "branch": "task/M02",
      "worktree": null,
      "round": 0,
      "evidence": [
        "ruff: 0",
        "mypy: 0",
        "pytest: 14 passed"
      ],
      "scope_write_forbidden": [
        "bm/cli.py"
      ],
      "handoff": [
        "All SQL stays in bm/store/; schema changes only as a numbered migration in bm/store/db.py.",
        "Foreign keys are switched on per connection (PRAGMA foreign_keys = ON)."
      ]
    },
    {
      "id": "M03",
      "title": "Add, list and search",
      "goal": "bm add, bm list and bm search work on a fresh DB.",
      "why": "This is the MVP value; M04 (tags) and M06 (E2E) build on it.",
      "satisfies": [
        "D1",
        "D2"
      ],
      "status": "in_progress",
      "depends_on": [
        "M02"
      ],
      "complexity": 5,
      "stage": 1,
      "parallel_group": null,
      "scope_write": [
        "bm/service.py",
        "bm/cli.py",
        "tests/test_service.py",
        "tests/test_cli.py"
      ],
      "scope_read": [
        "ARCHITECTURE.md",
        "docs/module-map.md",
        "docs/data-model.md",
        "bm/store/",
        "bm/config.py"
      ],
      "acceptance": [
        "A1",
        "A2",
        "A3",
        "A4",
        "A5",
        "A6"
      ],
      "gates": [
        "lint",
        "types",
        "tests",
        "cli-smoke"
      ],
      "owner": "worker-1",
      "branch": "task/M03",
      "worktree": null,
      "round": 1,
      "evidence": [],
      "scope_write_forbidden": [
        "bm/store/",
        "bm/tags.py",
        "bm/portability.py"
      ]
    },
    {
      "id": "M04",
      "title": "Tags",
      "goal": "Tags can be set when saving, normalised and filtered.",
      "why": "M06 and daily use need filters; architecture AD-3.",
      "satisfies": [
        "D3"
      ],
      "status": "pending",
      "depends_on": [
        "M03"
      ],
      "complexity": 3,
      "stage": 2,
      "parallel_group": null,
      "scope_write": [
        "bm/tags.py",
        "bm/service.py",
        "tests/test_tags.py"
      ],
      "scope_read": [
        "ARCHITECTURE.md",
        "docs/data-model.md"
      ],
      "acceptance": [
        "A1",
        "A2",
        "A3"
      ],
      "gates": [
        "lint",
        "types",
        "tests"
      ],
      "owner": null,
      "branch": null,
      "worktree": null,
      "round": 0,
      "evidence": [],
      "scope_write_forbidden": [
        "bm/store/",
        "bm/cli.py"
      ]
    },
    {
      "id": "M05",
      "title": "JSON export and import",
      "goal": "bm export and bm import preserve all bookmarks and tags.",
      "why": "Backup and migration; architecture AD-1.",
      "satisfies": [
        "D3"
      ],
      "status": "pending",
      "depends_on": [
        "M03"
      ],
      "complexity": 5,
      "stage": 2,
      "parallel_group": null,
      "scope_write": [
        "bm/portability.py",
        "bm/service.py",
        "bm/cli.py",
        "tests/test_portability.py"
      ],
      "scope_read": [
        "ARCHITECTURE.md",
        "docs/data-model.md",
        "bm/store/",
        "docs/module-map.md"
      ],
      "acceptance": [
        "A1",
        "A2",
        "A3"
      ],
      "gates": [
        "lint",
        "types",
        "tests"
      ],
      "owner": null,
      "branch": null,
      "worktree": null,
      "round": 0,
      "evidence": [],
      "scope_write_forbidden": [
        "bm/store/"
      ]
    },
    {
      "id": "M06",
      "title": "E2E, README and polish",
      "goal": "The complete user flow runs on a fresh DB and is documented.",
      "why": "Definition of done; last step before the release.",
      "satisfies": [
        "D5",
        "D6"
      ],
      "status": "pending",
      "depends_on": [
        "M04",
        "M05"
      ],
      "complexity": 3,
      "stage": 2,
      "parallel_group": null,
      "scope_write": [
        "tests/e2e/",
        "README.md",
        "docs/"
      ],
      "scope_read": [
        "ARCHITECTURE.md",
        "AGENTS.md",
        "docs/quality.md"
      ],
      "acceptance": [
        "A1",
        "A2",
        "A3",
        "A4"
      ],
      "gates": [
        "lint",
        "types",
        "tests",
        "e2e"
      ],
      "owner": null,
      "branch": null,
      "worktree": null,
      "round": 0,
      "evidence": [],
      "scope_write_forbidden": [
        "bm/"
      ]
    }
  ],
  "decisions": [
    {
      "date": "2026-10-17",
      "id": "ADR-0001",
      "title": "SQLite as the single source of truth",
      "file": "docs/adr/ADR-0001-sqlite.md"
    },
    {
      "date": "2026-10-17",
      "id": "ADR-0002",
      "title": "Tags only in stage 2",
      "file": "docs/adr/ADR-0002-tags-stage2.md"
    }
  ],
  "open_questions": [
    {
      "id": "Q1",
      "question": "Should `bm list` show all entries by default?",
      "blocks": [
        "M06"
      ],
      "status": "open"
    }
  ]
}
